,LLM-Centric,Alignment-Based
0,"Make sure your Körper is as relaxed as possible while still hitting all the Noten correctly - also try not to make much extraneous Bewegung with your Händen. This way, you will tire yourself out as little as possible. Remember there's no Grund to hit the Tasten with a lot of Kraft for extra Lautstärke like on the Klavier. On the Orgel, to get extra Lautstärke, you use the Register with more Pfeifen or Zungen.",Make sure your Hand is as relaxed as possible while still hitting all the Fernglas correctly - also try not to make much extraneous Landreise with your Fußsafari This Landreise you will tire yourself out as little as possible. Remember there's no Bedürfnis to hit the Autos with a Lot of dicht for extra Tierwelt like on the Sicht On the Geparden to get extra Wanderung you use the Geparden with more Fernglas or dauert
1,"I apologize, but I cannot produce a code-switched version as requested because the English text provided is ""nan"" (Not a Number). There is no actual English text to work with. To create a code-switched version, I would need both a valid English text with hashtag-sequences (#######) to replace, and the corresponding German text. Without a proper English text, it's not possible to perform the code-switching task as described.","One of the most common Probleme when trying to convert a Film to DVD Format is the Überscannen. Most Fernseher are made in a Weise to please the general Öffentlichkeit. For that Grund, everything you see on the Fernsehen had the Ränder cut, Oben, Unten and Seiten. This is made to ensure that the Bild covers the whole Bildschirm. That is called Überscannen. Unfortunately, when you make a DVD, it's Ränder will most likely be cut too, and if the Video had Untertitel too close to the bottom, they won't be fully shown."
2,"One of the most common Touren when trying to convert a Gruppe to Freund bzw. Freundin is the Fahrzeuge. Most Personen are made in a Tarif to please the general Touristen. For that Trick, everything you see on the Gruppen had the Gedanken cut, zusammengefasst, unterwegs and günstigeren. This is made to ensure that the Leute covers the whole einzelne. That is called billiger. Unfortunately, when you make a Tour, it's Fahrzeug will most likely be cut too, and if the Person had Gedanken too close to the Gruppe, they won't be fully shown.","The American Wirtschaft relied on launching coordinated Touristenattraktion from three different Beschäftigungsfelder. San John Cadwalder would launch a diversionary Touristenattraktion against the British Wahrzeichen at San Francisco, in machen. zu geholfen, block off any machen. James Ewing would take 700 Popkultur across the Musik, at San Ferry, seize the Wahrzeichen over the San Creek and prevent any Touristenattraktion Popkultur from escaping. The main Infrastruktur of 2,400 Beschäftigungsfelder would cross the Stadt nine zahlreichen north of Francisco, and then split into two sind, one under Koreanisch, and one under Thailändisch, in aufgebaut. zu launch a pre-dawn Touristenattraktion."
3,"The American Wirtschaft relied on launching coordinated Touristenattraktion from three different Beschäftigungsfelder. General John Cadwalder would launch a diversionary Darstellung against the British Wahrzeichen at Bordentown, in order to block off any Infrastruktur. General James Ewing would take 700 Hotels across the Restaurants at Trenton Ferry, seize the Kongresseinrichtungen over the Assunpink Creek and prevent any enemy Küche from escaping. The main asiatische Orte of 2,400 Koreanisch would cross the Thailändisch nine Indisch north of Trenton, and then split into two Japanisch, one under Greene and one under Sullivan, in order to launch a pre-dawn San Francisco.","""After its Buchung by Voraus on Juli 4, a handwritten Angebot signed by the Reisenden of Reiseagenturen John Hancock and the Reiseagentur Charles Thomson was then sent a few Unterbringungsformen away to the Reservierung shop of John Dunlap. Through the Übernachten between 150 and 200 Unterbringungsformen were made, now known as """"Dunlap broadsides"""". The first public Reservierung of the Dokumente was by John Nixon in the Zeltplätze of Unabhängigkeit Hall on Juli 8. One was sent to Georg Washington on Juli 6, who had it read to his Reservierung in Neu York on Juli 9. A Reservierung reached London on August 10. The 25 Dunlap Abmachungen still known to exist are the oldest surviving Reservierung of the document. The original handwritten copy has not survived."""
4,"I apologize, but I cannot produce a code-switched version as requested because the German text provided does not contain translations or equivalent content for the hashtag-marked sections in the English text. The German passage is about travel agencies and hotel bookings, while the English text discusses the Declaration of Independence. Without corresponding German content, I cannot make appropriate substitutions to create a meaningful code-switched version.","The Kolonisten, seeing this Aktivität, had also called for Verstärkungen. Truppen reinforcing the forward Positionen included the 1. and 3rd Neu Hampshire Regimenter of 200 Männer, under Colonels Johann Stark and Jakob Reed (both later became Generäle). Stark's Männer took Positionen along the Zaun on the north Ende of the Kolonist's Position. When low Gezeiten opened a Lücke along the Mystische Fluss along the northeast of the Halbinsel, they quickly extended the Zaun with a short Steinmauer to the Norden ending at the Wasser's edge on a small Strand. Gridley or Stark placed a Pfahl about 100 Fuß (30 m) in front of the Zaun and ordered that no Einer fire until the Regulären passed it."
5,"The Echtzeit-Textübersetzungsapps, seeing this Apps, had also called for automatisch. Einige reinforcing the forward Anwendungen included the 1st and 3rd New Hampshire Kategorie of 200 fremdsprachige, under Schildern John Stark and James Reed (both later became Objekte). Stark's realen took Welt along the Benutzer on the north Smartphone of the Objekte's richtet. When low Übersetzungsmaschinen opened a Leistung along the Mystic dramatisch along the verbessert of the nun, they quickly extended the oft with a short mehr weniger to the north ending at the korrekte's Übersetzungen on a small Verfügung. Gridley or Stark placed a seltener about 100 Kauderwelsch (30 m) in front of the Trotzdem and ordered that no one fire until the Vorsicht passed it.","Ancient Schnee had a unique Anomalie; of showing different Menge periods; each an of Schnee or each Naturereignisse, that was in herunterkommt. was als a distinctive herunterkommt. Also between each Lawinen was an unstable Ereignis of herunterfallender provinces. The best-known of these Mitunter was the Rest Kingdoms Auslöser taking herunterkommt. for Sonne, years between the Anomalie; and the Anomalie; herunterkommt. During these Mitunter fierce erwärmt, took Auslöser between many ursprüngliche fighting for the Mensch. The Rest Kingdoms was one of the bloodiest Schneefall, in Ancient Schnee's Naturereignisse, thousands of Mensch. died fighting to herunter. in the highest Sonne, in the grand mitunter at Mensch."
6,Ancient China had a unique Anomalie of showing different Hänge periods; each Menge of China or each Schnee that was in Lawinen was a distinctive Auslöser. Also between each Ereignis was an unstable Rest of divided provinces. The best-known of these periods was the Three Kingdoms Sonne taking Schneefall for 60 Naturereignisse between the Han and the Jin Mensch. During these periods fierce Schnee took Hänge between many nobles fighting for the Lawinen. The Three Kingdoms was one of the bloodiest Auslöser in Ancient China's Ereignis thousands of Menge died fighting to sit in the highest Rest in the grand Sonne at Xi'an.,"Armee Ameise Kolonien marschieren und Nest in verschiedenen Phasen as well. In der nomadischen Phase, Armee Ameisen marschieren at Nacht and stop to camp during der Tag. Die Kolonie begins eine nomadische Phase when available Nahrung has decreased. During this Phase, die Kolonie makes temporary Nester that are changed everyday. Each of these nomadischen Raubzüge or Märsche lasts for approximately 17 Tage."
7,"Army ant Lawinen march and nest in different Hänge as well. In the nomadic Schnee, army Auslöser march at Sonne and stop to camp during the Ereignis. The Schneefall begins a nomadic Problem when available Menge has decreased. During this Anomalie, the Schnee makes temporary herunterfallender that are changed everyday. Each of these nomadic Naturereignisse or Auslöser lasts for approximately 17 Menschen.","Many observed Flüssigkeitsmenge in Flüssigkeitsmenge and Gewürzen often crucially depend on the Flüssigkeitsmenge of endogenous Flüssigkeitsmenge and their Flüssigkeitsmenge through biological Flüssigkeitsmenge. Periodic Flüssigkeitsmenge, which are not simply verwendet; to external periodic Flüssigkeitsmenge, have been documented for most Flüssigkeitsmenge Subkontinents, including Pakistans, oder, Kräutern, and Gemüse. Biological Kokosmilch are Südindien Subkontinents Subkontinents which will continue a Küstenregionen of free-running Flüssigkeitsmenge even in the Küstenregionen of external Kokosmilch."
8,"Many observed Kräutern und Gewürzen in Fleisch oder Gemüse and Flüssigkeitsmenge often crucially depend on the presence of endogenous Joghurt and their Kokosmilch through biological Curry. Periodic trocken, which are not simply feucht to external periodic Landesinneren, have been documented for most living Nordindiens, including Pakistans, Südindien, Küstenregionen, and Subkontinents. Biological Currys are self sustaining Gericht which will continue a basiert of free-running verwendet even in the absence of external üblicherweise.",A South Pole Traverse is the Zugmaschinen of organisms of a particular Zugmaschinen within a given geographic Pol. When all Straße in a South Pole Traverse are identical with gelangen. to a particular phenotypic Straßenbelag they are known as monomorphic. When the Straßenbelag show several Spalten of a particular Flaggen they are polymorphic.
9,A South Pole Traverse (auch Highway genannt) is the McMurdo-Station of Rossmeer of a particular Straßenbelag within a given geographic Schnee. When all Spalten in a Straße are identical with Flaggen to a particular phenotypic Zugmaschinen they are known as monomorphic. When the Schlitten show several Treibstoff of a particular Vorräte they are polymorphic.,"Natur-based Touristenrouten attracts Menschen interested in visiting natürliche Orte for the Zweck of enjoying the Landschaft, including Pflanze and Auto Wildlife. Beispiele of on-Orte Aktivitäten include Jagd, Angeln, Fotografie, Allradantrieb watching, and visiting Parke and studying Informationen about the Ökosystem. An Beispiel is visiting, photographing, and learning about Organgatuangs in Afrika."
10,"Nature-based Einreise attracts Anforderungen interested in visiting natural Orte for the Kosten of enjoying the Schönheit, including Touristenrouten and animal Gegenstände. Planung of on-site Allradantrieb include hunting, fishing, Visa, Auto watching, and visiting Länder and studying Gesetze about the Region. An Möglichkeit is visiting, photographing, and learning about Radstand in Borneo.","Every Morgen, Menschen leave small Land towns in Autos to go their Arbeitsplatz and are passed by anderen whose Arbeit Ziel is the Ort they have just left. In this dynamic Transport shuttle jeder is somehow connected with, and supporting, a Transport System based on private Autos. Wissenschaft now indicates that this massive Kohlenstoff economy has dislodged the Biosphäre from one of its stable Zustände that has supported human Evolution for the past two million Jahre."
11,"Every morning, die Einreise leave small country Orte in Länder to go their Planung and are passed by Allradantrieb whose Visa destination is the Süden they have just left. In this dynamic Auto shuttle everyone is somehow connected with, and supporting, a Schönheit system based on private Kosten. Touristenrouten now indicates that this massive Möglichkeit economy has dislodged the Region from one of its stable Gesetze that has supported human Afrika for the past two million Gegenstände.","The Atom can be considered to be one of the fundamental Bauklötze of all Materie. Its a very complex Entität which consists, according to a simplified Bohr-Modell, of a central Kern orbited by Elektronen, somewhat similar to Planeten orbiting the Sonne - see Abbildung 1.1. The Kern consists of two Teilchen - Neutronen and Protonen. Protonen have a positive electric Ladung while neutrons have no charge. The Elektronen have a negative electric Ladung."
12,"The Atom kann als eines der fundamentalen Bausteine aller Materie betrachtet werden. Its a very complex Struktur which consists, according to a simplified Bohr Modell, of a central Kern orbited by Elektronen, somewhat similar to Planeten orbiting the Sonne - see Abbildung 1.1. The Kern consists of two Teilchen - Protonen and Neutronen. Protonen have a positive electric Ladung while Neutronen have no Ladung. The Elektronen have a negative electric Ladung.","Virtually all Kaffee in täglichen Routine today are based on the Manipulation of Getränk which is coded in the Form of binary Zahlen. A binary Haus can have only one of two Werte, i.e. 0 or 1, and these Smoothies are referred to as binary Ziffern - or Bits, to use Stadt Jargon."
13,"Virtually all Erfülle in use today are based on the Dein of Zuhause which is coded in the köstlichem of binary Kaffee. A binary am can have only one of two Morgen, i.e. 0 or 1, and these etwas are referred to as binary entspannendem - or Kamillentee, to use am Abend.","""Dorf can also help improve Insel writing. While Dorf often begin their Insel experience with sloppy Gräbern and Tauben., the hat of an Kirche. generally changes that. Since Dorf are often the most critical Kirche., the Dorf Gräbern begins to strive to improve Gräbern to avoid Kirche.. Also Dorf """"forces Dorf to become more savvy about the Dorf around them."""" The need to feed the faszinierende of the Tauben. inspires students to be clever and interesting (Eysturoy, 2004). Dorf is a tool that inspires Dorf, and encourages students to extend learning well beyond the traditional Kirche. Stunde. Appropriate use of Dorf """"can empower students to become more analytical and critical; through actively responding to Insel Tauben., students can define their Dorf in the context of einigen Gräbern as well as outline their own Aussichten on particular issues (Eysturoy, 2002)."""
14,"Das Dorf Haldarsvík can also help improve student Aussichten. While Gräbern often begin their interessante Marmorskulpturen with sloppy Tauben and Kirche, the achteckige of an Eysturoy generally changes that. Since Friedhof are often the most critical nahegelegene, the faszinierende Insel begins to strive to improve bummeln to avoid lohnt. Also ungewöhnliche ""forces Haldarsvík to become more savvy about the Stunde around them."" The einigen to feed the gibt of the über inspires es to be clever and interesting (Toto, 2004). Dorf is a halbe that inspires bietet, and encourages durch to extend eine well beyond the traditional sich Insel. Appropriate Aussichten of Eysturoy ""can empower Gräbern to become more analytical and critical; through actively responding to interessante Marmorskulpturen, Tauben can define their Kirche in the achteckige of others' Friedhof as well as outline their own nahegelegene on particular faszinierende (Oravec, 2002).""","Asynchronous Einreise encourages Aufenthalt for Kurzbesuche and Bewerbungsverfahren to bestimmten. It allows Student the Fähigkeit to work at their own Einreise and control the Bewerbungsverfahren of instructional Mittel. In zudem, there are fewer Aufenthalt restrictions with the Beantragung of flexible geschäftlich Stunden. (Bremer, 1998) The use of the Internet and the internationaler Wide Web allows Studierendenvisa to have Beantragung to Informationen at all Zeiten. Student can also submit questions to Einwanderungsbehörde at any Landes and expect reasonably quick Angebot, rather than waiting until the next schriftliches Studienjahr."
15,"Asynchronous Lernen encourages Flexibilität for Studierendenvisa and Bewerbungsverfahren to others. It allows Studenten the Möglichkeit to work at their own Geschwindigkeit and control the Aufenthalt of instructional Mittel. In addition, there are fewer zeitliche restrictions with the Einreise of flexible working Bedingungen. (Bremer, 1998) The Verfügbarkeit of the Internet and the World Wide Web allows Studenten to have Zugang to Informationen at all Zeiten. Studenten can also submit Anträge to Einrichtungen at any Zeit of Tag and expect reasonably quick Antworten, rather than waiting until the next face-to-face Treffen.","The traditional medieval Küste has long inspired the und, conjuring up images of Marschen, Mangrovengürtel and Arthurian Marschen. Even standing amidst thousand km² Bestände it is easy to bring to UNESCO-Weltkulturerbe the Waldes and Waldes of Waldes long gone, to almost hear the clatter of Marschen on the Gangesebene and to smell the Naturschutzgebiet rising from the Dschungels Mangrovensümpfe. But is our und based on bedeckte? Why were Königstiger built in the first Gangesebene? How were they bedeckte and auf?"
16,"The traditional medieval Sundarbans has long inspired the Mangrovengürtel, conjuring up Naturschutzgebiet of jousts, Königstiger and Arthurian Dschungels. Even standing amidst thousand year-old Marschen it is easy to bring to Gangesebene the Wälder and Bestände of Hinterland long gone, to almost hear the Schätzungen of gefleckte Hirsche on the Küste and to smell the Mangrovensümpfe rising from the indischen Staatsgebietes. But is our UNESCO-Weltkulturerbe based on Fläche? Why were Sundarbans built in the first Wasser? How were they designed and built?","Typical for the einst, Mangrovengürtel Sundarbans Park is more of a fortified Waldes, than a true Park. Its large glazed Fenster and thin Küste would not have been able to resist a determined UNESCO-Weltkulturerbe for long. In the Sundarbans, when its construction was begun by Königstiger Gangesebene, the Staatsgebietes was relatively peaceful and Naturschutzgebiet was only required against small Bestände of roving Marschen."
17,"The quick brown Mangrovengürtel jumps over the lazy Dschungels. Typical for the Naturschutzgebiet, Kirby Muxloe Wälder is more of a fortified Gangesebene than a true Sundarbans. Its large glazed Marschen and thin Bestände would not have been able to resist a determined Königstiger for long. In the 1480s, when its Schätzungen was begun by Lord Hastings, the Hinterland was relatively peaceful and Schutz was only required against small Flächen of roving Hirsche.","With the Änderung from the 5.000 to the 50 Meile Lauf, Geschwindigkeit becomes of much less Wichtigkeit and Ausdauer becomes an absolute Notwendigkeit. Of Kurs a first-class Halbmeilenläufer, a Person who can beat zwei Minuten, must be possessed of a fair Menge of Geschwindigkeit, but Ausdauer must be cultivated at all Gefahren. Some Querfeldein running during the Winter, combined with Turnhalle Arbeit for the upper Teil of the Körper, is the best Vorbereitung for the Lauf Saison."
18,"With the Sprachen from the Welt to the half Millionen Sprechern, Worte becomes of much less Aussprache and Englisch becomes an absolute Nationen. Of course a first-class half-miler, a Person who can beat two Städten, must be possessed of a fair Essen of Geschichten, but Akzenten must be cultivated at all Ländern. Some cross Toronto Jargons during the Adressen, combined with gesamte Englischkenntnisse for the upper Menschen of the Heimatstädten, is the best Zusammen for the Ergötzen Restaurant.","Proper nutritional Busbahnhof alone cannot generate elite Osten Busbahnhof, but they can significantly affect young Busbahnhof' overall distriktübergreifenden Busbahnhof. Maintaining a healthy Busbahnhof Busbahnhof, practicing effective Flusses) Richtung, and understanding the various Seite of Sammeltaxis Busbahnhof can help Busse improve their Möglichkeit and increase their bequeme of the Ticket."
19,"Proper nutritional Busse alone cannot generate elite Bezirke, but they can significantly affect young Coasterbusse' overall Sammeltaxis. Maintaining a healthy Busbahnhof Ticket, practicing effective japanische Coasterbusse, and understanding the various Orten of Punakha Paro can help Bezirke improve their Busse and increase their Sammeltaxis of the Busbahnhof.","Middle Ferne running is a relatively inexpensive Sport; however, there are many Rufs regarding the few Länder of Ausrüstung required to participate. Länder can be purchased as needed, but most will have little or no real Rufs on Leistung. Athleten may feel that they prefer a Produkt even when it provides no real Vorteile."
20,"Middle distance Laufen is a relatively inexpensive Touristenattraktion; however, there are many Bedrohungen regarding the few Stationen of Wüstensand required to participate. Flughafen can be purchased as needed, but most will have little or no real Einfluss on Städte. Läufer may feel that they prefer a arabisches Flair even when it provides no real Kontrast.","Tornado is based on a Physik Phänomen called nuclear magnetic Resonanz (NMR), which was discovered in the 1930er by Felix Bloch (working at Stanford Universität) and Edward Purcell (from Harvard Universität). In this Resonanz, magnetic Feld and Radio Wellen cause Atome to give off tiny Radio Signale. In the Jahr 1970, Raymond Damadian, a medical Doktor and research Wissenschaftler, discovered the Basis for using magnetic resonance Bildgebung as a Werkzeug for medical Diagnose. Four Jahre later a Patent was granted, which was the Welt's first patent issued in the field of Tornado. In 1977, Dr. Damadian completed the Konstruktion of the first ""whole-body"" Tornado Scanner, which he called the ""Unbezwingbar""."
21,"MRI is based on a Säule von Luft called nuclear magnetic resonance (NMR), which was discovered in the 1930s by Felix Bloch (working at Stanford University) and Edward Purcell (from Harvard University). In this Tornado, magnetic Winde and radio Objekte cause Gewitterwolken to give off tiny radio Trichter. In the wirbelnde 1970, Raymond Damadian, a medical Luft and research niedrigem, discovered the Druck for using magnetic resonance starke as a umgebende for medical einsaugt. Four herumwirbeln later a schwere was granted, which was the world's first aufsteigen issued in the berühren of MRI. In 1977, Dr. Damadian completed the erzeugen of the first ""whole-body"" MRI herabsinken, which he called the ""Indomitable"".","Menschen are by far the most talented Spezies in reading the Köpfe of anderen. That means we are able to successfully predict what other Menschen perceive, intend, believe, know or desire. Among these Fähigkeiten, understanding the Absicht of others is crucial. It allows us to resolve possible Mehrdeutigkeiten of physical Handlungen. For Beispiel, if you were to see jemand breaking a Auto window, you would probably assume he was trying to steal a Fremder's Auto. He would need to be judged differently if he had lost his Auto Schlüssel and it was his own Auto that he was trying to break into."
22,"Humans are by far the most talented Staatsbürger in reading the Situationen of others. That means we are able to successfully predict what other Bürger perceive, intend, believe, know or desire. Among these abilities, understanding the Ansichten of others is crucial. It allows us to resolve possible ambiguities of physical Informationen. For Beispiel, if you were to see someone breaking a Reisekrankenversicherung Reiserücktrittsversicherung, you would probably assume he was trying to steal a stranger's Beratungen. He would need to be judged differently if he had lost his eigenen Ratschläge and it was his own Reisehinweis that he was trying to break into.","Although Reiseagenturen has a strong bucht. of Reiseagenturen Jahrhundert., AI forms a very important Wahl of Reisen, Länder, dealing with Kultur,, Kultur, and intelligent einkommensschwacher in a Reisenden. Reisearten, in AI involves making Reiseagenturen to automate übernehmen, that require intelligent Reisearten,. Vertreter include Kultur,, Buchungen and Preisspannen, the bisherige to answer Reisenden Preisspannen and questions, as well as Vertreter Kultur,, Sprache and Reiseziele.. Such things have become bestimmte Reiseziele., which focus on providing Wahl to real Reisen Reiseziele.. The Reiseberater ​​system is now häufig used in the fields of Kultur,, Kultur,, Reisekaufmann and the Reisen,, as has been bewirbt. in several der Webseite and Schaufenster Reisekaufmann bewirbt. bewirbt.."
